<?xml version="1.0" encoding="UTF-8"?>
<xs:schema attributeFormDefault="unqualified" elementFormDefault="qualified" xmlns:xs="http://www.w3.org/2001/XMLSchema">
  <xs:element name="list">
    <xs:complexType>
      <xs:sequence>
        <xs:element name="product" maxOccurs="unbounded" minOccurs="0">
          <xs:complexType>
            <xs:sequence>
              <xs:element name="item">
                <xs:complexType>
                  <xs:simpleContent>
                    <xs:extension base="xs:string">
                      <xs:attribute type="xs:short" name="id" use="optional"/>
                      <xs:attribute type="xs:byte" name="count" use="optional"/>
                    </xs:extension>
                  </xs:simpleContent>
                </xs:complexType>
              </xs:element>
            </xs:sequence>
            <xs:attribute type="xs:int" name="id" use="optional"/>
            <xs:attribute type="xs:string" name="name" use="optional"/>
            <xs:attribute type="xs:byte" name="category" use="optional"/>
            <xs:attribute type="xs:short" name="price" use="optional"/>
            <xs:attribute type="xs:string" name="on_sale" use="optional"/>
			<xs:attribute type="xs:string" name="is_event" use="optional"/>
			<xs:attribute type="xs:string" name="is_best" use="optional"/>
			<xs:attribute type="xs:string" name="is_new" use="optional"/>
            <xs:attribute type="xs:string" name="sale_start_date" use="optional"/>
            <xs:attribute type="xs:string" name="sale_end_date" use="optional"/>
			<xs:attribute type="xs:byte" name="day_of_week" use="optional"/>
			<xs:attribute type="xs:byte" name="max_stock" use="optional"/>
          </xs:complexType>
        </xs:element>
      </xs:sequence>
    </xs:complexType>
  </xs:element>
</xs:schema>