<?xml version='1.0' encoding='utf-8'?>
<list xmlns:xsi="http://www.w3.org/2001/XMLSchema-instance" xsi:noNamespaceSchemaLocation="../xsd/product.xsd">
    <product id="1080001" name="Queen Ant Ring" category="5" price="10" is_best="true" on_sale="true">
		<item id="6660" count="1" />
	</product>
	<product id="1080002" name="Middle fortuna box" category="5" price="270" is_best="true" on_sale="true">
		<item id="22001" count="1" />
	</product>
	<product id="1080003" name="Large fortuna box" category="5" price="405" is_best="true" on_sale="true">
		<item id="22002" count="1" />
	</product>
	<product id="1080004" name="Huge Fortuna Box" category="5" price="610" is_best="true" on_sale="true">
		<item id="20515" count="1" />
	</product>
	<product id="1080005" name="Small fortuna cube" category="5" price="81" is_best="true" on_sale="true">
		<item id="22003" count="1" />
	</product>
	<product id="1080006" name="Middle fortuna cube" category="5" price="216" is_best="true" on_sale="true">
		<item id="22004" count="1" />
	</product>
	<product id="1080007" name="Large fortuna cube" category="5" price="324" is_best="true" on_sale="true">
		<item id="22005" count="1" />
	</product>
	<product id="1080008" name="Huge Fortuna Cube" category="5" price="524" is_best="true" on_sale="true">
		<item id="20516" count="1" />
	</product>
	<product id="1080009" name="Allegra Box" category="5" price="139" is_best="true" on_sale="true">
		<item id="22310" count="1" />
	</product>
	<product id="1080010" name="Latus Box" category="5" price="279" is_best="true" on_sale="true">
		<item id="22311" count="1" />
	</product>
</list>