<?xml version='1.0' encoding='utf-8'?>
<list xmlns:xsi="http://www.w3.org/2001/XMLSchema-instance" xsi:noNamespaceSchemaLocation="../xsd/product.xsd">
	<product id="1080049" name="A Scroll Bundle of Fighter" category="4" price="52" on_sale="true">
		<item id="22087" count="1" />
	</product>
	<product id="1080050" name="A Scroll Bundle of Mage" category="4" price="59" on_sale="true">
		<item id="22088" count="1" />
	</product>
	<product id="1080140" name="Beast Soulshot Pack" category="4" price="14" is_new="true" on_sale="true">
		<item id="20326" count="1" />
	</product>
	<product id="1080141" name="Beast Spiritshot Pack" category="4" price="11" is_new="true" on_sale="true">
		<item id="20327" count="1" />
	</product>
	<product id="1080229" name="Hunting Helper Exchange Coupon - 1 sheet" category="4" price="169" is_new="true" on_sale="true">
		<item id="13273" count="1" />
	</product>
	<product id="1080230" name="Hunting Helper Exchange Coupon - 3 sheet" category="4" price="506" is_new="true" on_sale="true">
		<item id="13273" count="3" />
	</product>
	<product id="1080233" name="Steam Beatle Mounting Bracelet 7 Day Pack" category="4" price="2695" is_new="true" on_sale="true">
		<item id="14232" count="1" />
	</product>
	<product id="1080234" name="Light Purple Maned Horse Bracelet 30 Day Pack" category="4" price="2695" is_best="true" is_new="true" on_sale="true">
		<item id="20059" count="1" />
	</product>
</list>